{
  "schemaVersion": "1.0",
  "skill": "postpublish-cleanup",
  "stage": "cleanup",
  "rootFolder": null,
  "producesArtifacts": false,
  "inputs": [
    {"relativePath": "lisa-config.json", "required": true, "kind": "config"},
    {"relativePath": "output", "required": true, "kind": "directory"}
  ],
  "runIdPattern": null,
  "allowedStatuses": ["inventory", "passed", "failed"],
  "manifest": null,
  "resultSchema": null,
  "files": [],
  "directories": [],
  "patterns": {},
  "forbiddenPathPatterns": []
}
